[
  {
    "id": "brook",
    "kind": "stage",
    "region": "리스항구",
    "place": "선착장",
    "name": "리스항구 · 선착장",
    "subtitle": "LITH HARBOR · PIER",
    "level": 1,
    "rebirth": 0,
    "fit": 0,
    "tier": 1,
    "terrain": null,
    "climate": null,
    "description": "빅토리아 아일랜드의 관문. 선착장 끝에서 첫 몬스터가 찾아온다.",
    "flavor": null,
    "lore": null,
    "ambient_lines": null,
    "monsters": [
      "minnow",
      "carp",
      "perch"
    ],
    "monster_hints": null,
    "tone": "#79bca8",
    "habitat": {
      "id": "lithSwarm",
      "subtitle": "LITH HARBOR · SWARM NEST",
      "description": "항구 뒤편 갯바위. 첫 바다의 몬스터들이 떼로 몰려와 한 덩어리로 덤빈다.",
      "tone": "#5fa8a0",
      "rebirth": 2,
      "signature": [
        "swarm"
      ]
    },
    "boss": null,
    "neighbor_hint": null,
    "tags": [
      "리스항구",
      "사냥터"
    ]
  },
  {
    "id": "bay",
    "kind": "stage",
    "region": "리스항구",
    "place": "조개 해안",
    "name": "리스항구 · 조개 해안",
    "subtitle": "LITH HARBOR · SHELL COAST",
    "level": 5,
    "rebirth": 0,
    "fit": 0,
    "tier": 1,
    "terrain": null,
    "climate": null,
    "description": "항구 뒤 조개껍데기가 깔린 해안. 버섯과 슬라임이 파도 소리에 맞춰 통통 튄다.",
    "flavor": null,
    "lore": null,
    "ambient_lines": null,
    "monsters": [
      "mackerel",
      "ray",
      "puffer"
    ],
    "monster_hints": null,
    "tone": "#68b6ce",
    "habitat": null,
    "boss": null,
    "neighbor_hint": null,
    "tags": [
      "리스항구",
      "사냥터"
    ]
  },
  {
    "id": "reef",
    "kind": "stage",
    "region": "헤네시스",
    "place": "돼지의 해변",
    "name": "헤네시스 · 돼지의 해변",
    "subtitle": "HENESYS · PIG BEACH",
    "level": 10,
    "rebirth": 0,
    "fit": 0,
    "tier": 1,
    "terrain": null,
    "climate": null,
    "description": "헤네시스 남쪽 해변. 돼지 떼가 모래밭을 뛰놀고, 버섯이 그늘에서 덮칠 틈을 노린다.",
    "flavor": null,
    "lore": null,
    "ambient_lines": null,
    "monsters": [
      "lionfish",
      "eel",
      "barracuda",
      "stormBarracuda"
    ],
    "monster_hints": null,
    "tone": "#d49081",
    "habitat": {
      "id": "henesysSwarm",
      "subtitle": "HENESYS · SWARM MEADOW",
      "description": "돼지와 버섯이 끝없이 몰려드는 들판. 한 번 휩쓸면 도감이 백 장씩 넘어간다.",
      "tone": "#c98a6a",
      "rebirth": 2,
      "signature": [
        "giant"
      ]
    },
    "boss": null,
    "neighbor_hint": null,
    "tags": [
      "헤네시스",
      "사냥터"
    ]
  },
  {
    "id": "kelp",
    "kind": "stage",
    "region": "헤네시스",
    "place": "버섯숲 연못",
    "name": "헤네시스 · 버섯숲 연못",
    "subtitle": "HENESYS · MUSHROOM POND",
    "level": 14,
    "rebirth": 0,
    "fit": 0,
    "tier": 2,
    "terrain": null,
    "climate": null,
    "description": "버섯 마을 숲속의 연못. 연못가 그늘마다 색이 다른 버섯들이 자란다.",
    "flavor": null,
    "lore": null,
    "ambient_lines": null,
    "monsters": [
      "seahorse",
      "needlefish",
      "tidejelly"
    ],
    "monster_hints": null,
    "tone": "#72b89b",
    "habitat": null,
    "boss": null,
    "neighbor_hint": null,
    "tags": [
      "헤네시스",
      "사냥터"
    ]
  },
  {
    "id": "wreck",
    "kind": "stage",
    "region": "페리온",
    "place": "유적 발굴지 수로",
    "name": "페리온 · 유적 발굴지 수로",
    "subtitle": "PERION · EXCAVATION CANAL",
    "level": 18,
    "rebirth": 0,
    "fit": 2,
    "tier": 2,
    "terrain": null,
    "climate": null,
    "description": "발굴지 아래로 흐르는 수로. 멧돼지가 내달리고, 깨어난 해골 병사와 돌거인이 유물을 지킨다.",
    "flavor": null,
    "lore": null,
    "ambient_lines": null,
    "monsters": [
      "ghost",
      "angler",
      "shark"
    ],
    "monster_hints": null,
    "tone": "#9e96c8",
    "habitat": {
      "id": "perionSwarm",
      "subtitle": "PERION · SWARM CANYON",
      "description": "바위 협곡을 메운 멧돼지와 골렘 떼. 버티지 못하면 한꺼번에 밀려난다.",
      "tone": "#b9744f",
      "rebirth": 2,
      "signature": [
        "abyssal"
      ]
    },
    "boss": null,
    "neighbor_hint": null,
    "tags": [
      "페리온",
      "사냥터"
    ]
  },
  {
    "id": "volcanic",
    "kind": "stage",
    "region": "페리온",
    "place": "불타는 땅 화구호",
    "name": "페리온 · 불타는 땅 화구호",
    "subtitle": "PERION · BURNING CRATER",
    "level": 24,
    "rebirth": 0,
    "fit": 5,
    "tier": 3,
    "terrain": null,
    "climate": null,
    "description": "바위산 너머 불타는 땅. 끓는 화구호 곁에서 불씨를 품은 골렘과 드레이크가 깨어난다.",
    "flavor": null,
    "lore": null,
    "ambient_lines": null,
    "monsters": [
      "emberEel",
      "ashRay",
      "magmaPuffer",
      "cinderKoi"
    ],
    "monster_hints": null,
    "tone": "#d17c62",
    "habitat": null,
    "boss": null,
    "neighbor_hint": null,
    "tags": [
      "페리온",
      "사냥터"
    ]
  },
  {
    "id": "trench",
    "kind": "stage",
    "region": "엘리니아",
    "place": "깊은 숲 늪",
    "name": "엘리니아 · 깊은 숲 늪",
    "subtitle": "ELLINIA · DEEP FOREST BOG",
    "level": 26,
    "rebirth": 0,
    "fit": 5,
    "tier": 3,
    "terrain": null,
    "climate": null,
    "description": "빛이 닿지 않는 숲 깊은 곳의 늪. 어둠 속에서 커다란 눈들이 모험가를 지켜본다.",
    "flavor": null,
    "lore": null,
    "ambient_lines": null,
    "monsters": [
      "viper",
      "squid",
      "leviathan"
    ],
    "monster_hints": null,
    "tone": "#5c9dba",
    "habitat": {
      "id": "elliniaSwarm",
      "subtitle": "ELLINIA · SWARM HOLLOW",
      "description": "숲의 그림자마다 몬스터가 겹겹이 숨어 있다. 망령까지 떼를 지어 떠오른다.",
      "tone": "#8f88c4",
      "rebirth": 3,
      "signature": [
        "starlit"
      ]
    },
    "boss": null,
    "neighbor_hint": null,
    "tags": [
      "엘리니아",
      "사냥터"
    ]
  },
  {
    "id": "moon",
    "kind": "stage",
    "region": "엘리니아",
    "place": "달빛 마법 호수",
    "name": "엘리니아 · 달빛 마법 호수",
    "subtitle": "ELLINIA · MOONLIT LAKE",
    "level": 34,
    "rebirth": 1,
    "fit": 5,
    "tier": 4,
    "terrain": null,
    "climate": null,
    "description": "마법사의 마을 위 달빛 호수. 나무 위의 루팡과 떠도는 망령 너머, 한 번의 생을 넘어선 모험가만 닿는다.",
    "flavor": null,
    "lore": null,
    "ambient_lines": null,
    "monsters": [
      "moonfish",
      "dragon",
      "ancient",
      "eclipseMoonfish"
    ],
    "monster_hints": null,
    "tone": "#b4afd6",
    "habitat": null,
    "boss": null,
    "neighbor_hint": null,
    "tags": [
      "엘리니아",
      "사냥터"
    ]
  },
  {
    "id": "starfall",
    "kind": "stage",
    "region": "커닝시티",
    "place": "네온 수로",
    "name": "커닝시티 · 네온 수로",
    "subtitle": "KERNING CITY · NEON CANAL",
    "level": 46,
    "rebirth": 2,
    "fit": 10,
    "tier": 5,
    "terrain": null,
    "climate": null,
    "description": "네온이 별비처럼 쏟아지는 도시의 수로. 거품과 박쥐, 비룡이 밤하늘을 가른다.",
    "flavor": null,
    "lore": null,
    "ambient_lines": null,
    "monsters": [
      "starKoi",
      "prismRay",
      "voidGuppy",
      "abyssManta",
      "novaManta"
    ],
    "monster_hints": null,
    "tone": "#9c8ed4",
    "habitat": {
      "id": "kerningSwarm",
      "subtitle": "KERNING CITY · SWARM SEWER",
      "description": "배수로 가득 차오른 몬스터의 물결. 다섯 번의 생으로도 모자란 곳.",
      "tone": "#6d7fb0",
      "rebirth": 7,
      "signature": [
        "swarm",
        "abyssal"
      ]
    },
    "boss": null,
    "neighbor_hint": null,
    "tags": [
      "커닝시티",
      "사냥터"
    ]
  },
  {
    "id": "duskVents",
    "kind": "stage",
    "region": "커닝시티",
    "place": "지하 배수로",
    "name": "커닝시티 · 지하 배수로",
    "subtitle": "KERNING CITY · UNDERGROUND DRAIN",
    "level": 55,
    "rebirth": 5,
    "fit": 10,
    "tier": 6,
    "terrain": null,
    "climate": null,
    "description": "도시 아래 끓어오르는 배수로. 다섯 번의 생을 건넌 모험가만 이 열기를 견딘다.",
    "flavor": null,
    "lore": null,
    "ambient_lines": null,
    "monsters": [
      "ventCrab",
      "glassSquid",
      "sulfurEel",
      "blindShark",
      "cinderAngler",
      "ventLeviathan"
    ],
    "monster_hints": null,
    "tone": "#d88a5a",
    "habitat": null,
    "boss": null,
    "neighbor_hint": null,
    "tags": [
      "커닝시티",
      "사냥터"
    ]
  },
  {
    "id": "coralForest",
    "kind": "stage",
    "region": "아쿠아로드",
    "place": "산호 숲",
    "name": "아쿠아로드 · 산호 숲",
    "subtitle": "AQUA ROAD · CORAL FOREST",
    "level": 70,
    "rebirth": 10,
    "fit": 10,
    "tier": 7,
    "terrain": null,
    "climate": null,
    "description": "빛이 산호 사이로 부서지는 바다 밑 숲. 씨코와 상어가 물결을 가르고, 수호병이 깊은 곳을 지킨다.",
    "flavor": null,
    "lore": null,
    "ambient_lines": null,
    "monsters": [
      "aqSeaco",
      "aqShark",
      "aqSquid",
      "aqFlower",
      "aqGuard"
    ],
    "monster_hints": null,
    "tone": "#4fa3c7",
    "habitat": {
      "id": "aquaSwarm",
      "subtitle": "AQUA ROAD · SWARM REEF",
      "description": "산호초를 뒤덮은 바다 몬스터의 떼. 물결이 통째로 덤벼든다.",
      "tone": "#3f8fb5",
      "rebirth": 14,
      "signature": [
        "swarm"
      ]
    },
    "boss": null,
    "neighbor_hint": null,
    "tags": [
      "아쿠아로드",
      "사냥터"
    ]
  },
  {
    "id": "dragonNest",
    "kind": "stage",
    "region": "리프레",
    "place": "용의 둥지",
    "name": "리프레 · 용의 둥지",
    "subtitle": "LEAFRE · DRAGON NEST",
    "level": 80,
    "rebirth": 15,
    "fit": 15,
    "tier": 8,
    "terrain": null,
    "climate": null,
    "description": "용의 숲 깊은 곳의 둥지. 드래곤 터틀이 바위처럼 엎드려 있고 와이번이 절벽을 돈다.",
    "flavor": null,
    "lore": null,
    "ambient_lines": null,
    "monsters": [
      "lfBlueTurtle",
      "lfRedTurtle",
      "lfWyvern",
      "lfSkelegon",
      "lfManticore"
    ],
    "monster_hints": null,
    "tone": "#7fb069",
    "habitat": {
      "id": "leafreSwarm",
      "subtitle": "LEAFRE · SWARM VALLEY",
      "description": "용의 숲 골짜기를 메운 비룡과 터틀의 무리. 날개 소리만으로 땅이 울린다.",
      "tone": "#6b9d58",
      "rebirth": 15,
      "signature": [
        "giant"
      ]
    },
    "boss": null,
    "neighbor_hint": null,
    "tags": [
      "리프레",
      "사냥터"
    ]
  },
  {
    "id": "memoryLane",
    "kind": "stage",
    "region": "시간의 신전",
    "place": "기억의 길",
    "name": "시간의 신전 · 기억의 길",
    "subtitle": "TEMPLE OF TIME · MEMORY LANE",
    "level": 90,
    "rebirth": 15,
    "fit": 15,
    "tier": 9,
    "terrain": null,
    "climate": null,
    "description": "시간이 멈춘 신전의 회랑. 기억의 수호병과 키메라가 지나온 생을 묻는다.",
    "flavor": null,